title,description,link
Cahiers,"Cashiers are responsible for processing customer transactions accurately while maintaining a friendly demeanor. They handle cash, credit card payments, and operate point-of-sale systems to ensure smooth checkout experiences for customers.",https://carrefour-careers.pages.dev/#openings
Stockers,"Stockers are responsible for replenishing shelves with products, ensuring they are well-organized and properly displayed. They also check inventory levels, rotate stock to prevent expired items, and maintain a clean and tidy shopping environment.",https://carrefour-careers.pages.dev/#openings
Packers,"Packers assist with bagging groceries at checkout, ensuring items are packed efficiently and securely for customers. They may also help with organizing and preparing products for delivery or storage, ensuring proper handling of goods.",https://carrefour-careers.pages.dev/#openings
Merchandisers,"Merchandisers are responsible for arranging products attractively on shelves to maximize sales and enhance the customer shopping experience. They ensure product displays are stocked, rotated, and aligned with promotional strategies while also tracking inventory levels.",https://carrefour-careers.pages.dev/#openings
Chefs,"Chefs prepares fresh, ready-to-eat meals and specialty dishes for customers, ensuring high quality and food safety standards. They may also develop recipes, manage kitchen operations, and assist with product promotions or in-store cooking demonstrations.",https://carrefour-careers.pages.dev/#openings
Butchers,"A butcher cuts, trims, and prepares various types of meat according to customer requests, ensuring quality and safety standards are met. They also manage inventory, display products attractively, and provide expert advice on meat selection and cooking methods.",https://carrefour-careers.pages.dev/#openings
E-commerce Agents,"E-commerce agents manage online orders, ensuring accurate processing, packing, and timely delivery or pickup for customers. They handle customer inquiries, resolve issues, and help maintain smooth digital shopping operations.",https://carrefour-careers.pages.dev/#openings
Delivery Agents,"Delivery agents are responsible for transporting orders to customers homes quickly and safely, ensuring timely and efficient deliveries. They also verify order accuracy, follow delivery routes, and maintain the condition of the products during transit.",https://carrefour-careers.pages.dev/#openings
